{
  "id": "node-npm-ca",
  "description": "Add supplied CA certificates to user-scope Node and npm trust",
  "schema": "urn:aihq:harness:repair:1.0.0",
  "scope": "user",
  "managementId": "node-npm-trust",
  "materialName": "trust.pem",
  "variants": [
    {
      "os": "win32",
      "architectures": [
        "x64",
        "arm64"
      ],
      "targets": [
        "node"
      ],
      "network": "declared",
      "recipeRef": "node-npm-ca/win32/node/declared",
      "transformId": "node-npm-ca-bindings"
    },
    {
      "os": "win32",
      "architectures": [
        "x64",
        "arm64"
      ],
      "targets": [
        "node"
      ],
      "network": "off",
      "recipeRef": "node-npm-ca/win32/node/off",
      "transformId": "node-npm-ca-bindings"
    },
    {
      "os": "win32",
      "architectures": [
        "x64",
        "arm64"
      ],
      "targets": [
        "npm"
      ],
      "network": "declared",
      "recipeRef": "node-npm-ca/win32/npm/declared",
      "transformId": "node-npm-ca-bindings"
    },
    {
      "os": "win32",
      "architectures": [
        "x64",
        "arm64"
      ],
      "targets": [
        "npm"
      ],
      "network": "off",
      "recipeRef": "node-npm-ca/win32/npm/off",
      "transformId": "node-npm-ca-bindings"
    },
    {
      "os": "win32",
      "architectures": [
        "x64",
        "arm64"
      ],
      "targets": [
        "node",
        "npm"
      ],
      "network": "declared",
      "recipeRef": "node-npm-ca/win32/node+npm/declared",
      "transformId": "node-npm-ca-bindings"
    },
    {
      "os": "win32",
      "architectures": [
        "x64",
        "arm64"
      ],
      "targets": [
        "node",
        "npm"
      ],
      "network": "off",
      "recipeRef": "node-npm-ca/win32/node+npm/off",
      "transformId": "node-npm-ca-bindings"
    },
    {
      "os": "darwin",
      "architectures": [
        "arm64",
        "x64"
      ],
      "targets": [
        "node"
      ],
      "network": "declared",
      "recipeRef": "node-npm-ca/darwin/node/declared",
      "transformId": "node-npm-ca-bindings"
    },
    {
      "os": "darwin",
      "architectures": [
        "arm64",
        "x64"
      ],
      "targets": [
        "node"
      ],
      "network": "off",
      "recipeRef": "node-npm-ca/darwin/node/off",
      "transformId": "node-npm-ca-bindings"
    },
    {
      "os": "darwin",
      "architectures": [
        "arm64",
        "x64"
      ],
      "targets": [
        "npm"
      ],
      "network": "declared",
      "recipeRef": "node-npm-ca/darwin/npm/declared",
      "transformId": "node-npm-ca-bindings"
    },
    {
      "os": "darwin",
      "architectures": [
        "arm64",
        "x64"
      ],
      "targets": [
        "npm"
      ],
      "network": "off",
      "recipeRef": "node-npm-ca/darwin/npm/off",
      "transformId": "node-npm-ca-bindings"
    },
    {
      "os": "darwin",
      "architectures": [
        "arm64",
        "x64"
      ],
      "targets": [
        "node",
        "npm"
      ],
      "network": "declared",
      "recipeRef": "node-npm-ca/darwin/node+npm/declared",
      "transformId": "node-npm-ca-bindings"
    },
    {
      "os": "darwin",
      "architectures": [
        "arm64",
        "x64"
      ],
      "targets": [
        "node",
        "npm"
      ],
      "network": "off",
      "recipeRef": "node-npm-ca/darwin/node+npm/off",
      "transformId": "node-npm-ca-bindings"
    },
    {
      "os": "linux",
      "architectures": [
        "x64",
        "arm64"
      ],
      "targets": [
        "node"
      ],
      "network": "declared",
      "recipeRef": "node-npm-ca/linux/node/declared",
      "transformId": "node-npm-ca-bindings"
    },
    {
      "os": "linux",
      "architectures": [
        "x64",
        "arm64"
      ],
      "targets": [
        "node"
      ],
      "network": "off",
      "recipeRef": "node-npm-ca/linux/node/off",
      "transformId": "node-npm-ca-bindings"
    },
    {
      "os": "linux",
      "architectures": [
        "x64",
        "arm64"
      ],
      "targets": [
        "npm"
      ],
      "network": "declared",
      "recipeRef": "node-npm-ca/linux/npm/declared",
      "transformId": "node-npm-ca-bindings"
    },
    {
      "os": "linux",
      "architectures": [
        "x64",
        "arm64"
      ],
      "targets": [
        "npm"
      ],
      "network": "off",
      "recipeRef": "node-npm-ca/linux/npm/off",
      "transformId": "node-npm-ca-bindings"
    },
    {
      "os": "linux",
      "architectures": [
        "x64",
        "arm64"
      ],
      "targets": [
        "node",
        "npm"
      ],
      "network": "declared",
      "recipeRef": "node-npm-ca/linux/node+npm/declared",
      "transformId": "node-npm-ca-bindings"
    },
    {
      "os": "linux",
      "architectures": [
        "x64",
        "arm64"
      ],
      "targets": [
        "node",
        "npm"
      ],
      "network": "off",
      "recipeRef": "node-npm-ca/linux/node+npm/off",
      "transformId": "node-npm-ca-bindings"
    }
  ],
  "targets": [
    "node",
    "npm"
  ],
  "inputs": {
    "caFile": {
      "type": "file",
      "required": true,
      "description": "Certificate-only PEM file"
    }
  },
  "limits": {
    "sourceBytes": 1048576,
    "certificateBlocks": 256,
    "blockBytes": 65536
  },
  "offlineVerification": [
    {
      "target": "node",
      "operationId": "node-config",
      "checkId": "node-tls"
    },
    {
      "target": "npm",
      "operationId": "npm-config",
      "checkId": "npm-behavior"
    }
  ]
}
